{
  "$schema": "https://json-schema.org/draft/2020-12/schema",
  "$id": "https://ligature-workspace/docs/boundary-contract-schema.json",
  "title": "Boundary contract (O) — v1.0",
  "description": "plan.md §2/§5. One per crates/*/specs/_boundaries/<caller_concept>_<caller_method>__to__<callee_concept>_<callee_method>.json. Prototype A scope: role safety only (G2+) -- no assurance-target field yet, that lands with the I-schema (M3).",
  "type": "object",
  "required": ["schema_version", "boundary_id", "caller", "callee", "callee_guarantees", "review"],
  "additionalProperties": false,
  "properties": {
    "schema_version": {
      "type": "string",
      "const": "1.0"
    },
    "boundary_id": {
      "type": "string",
      "description": "Must equal the filename stem exactly (G1b, enforced separately by scripts/validate_boundary_naming.py)."
    },
    "caller": { "$ref": "#/$defs/role" },
    "callee": { "$ref": "#/$defs/role" },
    "callee_guarantees": {
      "type": "array",
      "description": "The obligations this cross-concept call depends on (docs/reliance-policy.md resolution rule), in two roles. A callee POSTCONDITION/INVARIANT the caller relies on is a guarantee; a callee PRECONDITION the caller must establish is a caller obligation a bridge specification discharges (plan.md §8.2) and is declared here because a bridge's callee_requirement must be one of these entries (validate-bridge G2). G2+ reads each entry's own constraint `kind` and reports which role it is (scripts/validate_boundary_contracts.py), so a precondition here is not read as a callee postcondition. Never the caller's own obligations (G2+ rejects an entry naming the caller's concept) and never an adversary case (-> evidence only, G2+ rejects it here). An empty array declares that the call depends on nothing at all, so it is a claim rather than an omission.",
      "items": {
        "type": "string",
        "pattern": "^[A-Z][A-Za-z0-9]*\\.[A-Z][0-9]+$",
        "description": "<Concept>.<id>, e.g. TaskQueue.C003. Deliberately permissive at the schema layer (accepts the C-obligation shape and the A-adversary shape alike) -- G1a checks structure only. Whether the id names a real obligation, belongs to the right concept, and isn't an adversary case is G2+'s job (role safety), not this schema's -- see scripts/validate_boundary_contracts.py."
      }
    },
    "assumptions": {
      "type": "array",
      "items": { "$ref": "#/$defs/assumption_ref" }
    },
    "review": { "$ref": "#/$defs/review" }
  },
  "$defs": {
    "role": {
      "type": "object",
      "required": ["concept", "method"],
      "additionalProperties": false,
      "properties": {
        "concept": {
          "type": "string",
          "pattern": "^[A-Z][A-Za-z0-9]*$",
          "description": "PascalCase, matches the concept-to-code 'concept' field convention."
        },
        "method": {
          "type": "string",
          "pattern": "^[a-z][a-z0-9_]*$",
          "description": "snake_case Rust method name."
        }
      }
    },
    "assumption_ref": {
      "description": "Chainlink #59 phase B dual-resolution. A reference is EITHER the legacy composite {boundary_id, tracking_issue, assumption_hash} (still fully valid and authoritative; using it now emits a non-blocking deprecation finding) OR a registry reference {assumption_id} that resolves against docs/assumption-registry-schema.json. This is an additive, backward-compatible alternative -- the legacy branch is unchanged -- so the artifact schema_version stays 1.0; removing the legacy branch is phase D's declared breaking version (scripts/assumption_registry.py:ASSUMPTION_REF_LEGACY_REMOVAL_VERSION).",
      "oneOf": [
        {
          "type": "object",
          "required": ["boundary_id", "tracking_issue", "assumption_hash"],
          "additionalProperties": false,
          "properties": {
            "boundary_id": { "type": "string" },
            "tracking_issue": { "type": "string" },
            "assumption_hash": { "type": "string", "pattern": "^sha256:[0-9a-f]{64}$" }
          }
        },
        {
          "type": "object",
          "required": ["assumption_id"],
          "additionalProperties": false,
          "properties": {
            "assumption_id": { "type": "string", "pattern": "^ASM-[a-z0-9][a-z0-9-]*$" }
          }
        }
      ]
    },
    "review": {
      "type": "object",
      "required": ["reviewer", "reviewed_at"],
      "additionalProperties": false,
      "properties": {
        "reviewer": { "type": "string", "minLength": 1 },
        "reviewed_at": {
          "type": "string",
          "format": "date",
          "pattern": "^[0-9]{4}-[0-9]{2}-[0-9]{2}$"
        }
      }
    }
  }
}
